Coding Interviews	Binary Tree	Convert Binary Search Tree to Sorted Doubly Linked List	https://leetcode.com/problems/convert-binary-search-tree-to-sorted-doubly-linked-list/description/	Convert a Binary Search Tree to a sorted Circular Doubly-Linked List in place.  You can think of the left and right pointers as synonymous to the predecessor and successor pointers in a doubly-linked list. For a circular doubly linked list, the predecessor of the first element is the last element, and the successor of the last element is the first element.  We want to do the transformation in place. After the transformation, the left pointer of the tree node should point to its predecessor, and the right pointer should point to its successor. You should return the pointer to the smallest element of the linked list.	O(n)	O(h)	We're expecting an optimized solution of time complexity O(n) and memory complexity O(h).	Inorder Traversal + Sorting	Breadth-First traversal + Queue	Recursive Inorder Traversal + Doubly Linked List	Recursive Depth-First Search + Doubly Linked List Approach 	D	The idea is to use a queue to keep track of the current level of nodes. We traverse the tree and update the pointers to create the doubly linked link! This approach has a time complexity of O(n log n) due to sorting and a memory complexity of O(n) for storing the node values.	Due to the use of the queue, this approach would have a memory complexity of O(n), which isn't quite optimal here.	Highly inefficient. The idea?  Recursive Inorder Traversal of the tree, creating the doubly linked list as we go. Traverse the tree in in-order and create a doubly linked list as you go. For each node, traverse its left subtree, append the node to the end of the linked list, and then traverse its right subtree This approach has a time complexity of O(N^2) for traversing the linked list each time a node is appended and a memory complexity of O(1) for not using any additional data structures. O(1) memory complexity is achieved much more efficiently using Morris traversal (which was not listed among this set of answers)!	Correct...for this set of answers! Here, the recursion stack has a maximum depth of the height of the tree, which is O(h) in memory. The combination is done by combining the left and right subtrees with the current node in the middle, forming the final doubly linked list.It is possible to use different algorithms paradigms or data structures. For example, one could use a stack or queue to simulate the recursive call stack, but this would not improve the space or time complexity!  Morris traversal (not LISTED here) is even better in terms of space complexity, but it is a little obscure for most people!	A brute force approach to solving this problem would involve performing an in-order traversal of the binary search tree to get the nodes in sorted order, and then creating a circular doubly-linked list from the sorted nodes. The steps for this approach are as follows: 1) Traverse the left subtree recursively and then visit the current node. 2) Store the previous node visited during the traversal in a variable. 3) Set the left pointer of the current node to the previous node. 4) If the previous node is not null, set its right pointer to the current node. 5) Set the current node as the previous node for the next iteration. 6) Traverse the right subtree recursively. 7) Once the traversal is complete, set the left pointer of the first node to the last node, and the right pointer of the last node to the first node to make it a circular doubly-linked list. This approach has a time complexity of O(n) since it visits each node in the binary search tree exactly once, and a space complexity of O(n) for the recursive call stack.	https://github.com/rabogan/MasteringLeetCodeInterviewApproaches/blob/main/SolutionCode/CodingInterviewsPackSolutionsCPP/426.%20Convert%20Binary%20Search%20Tree%20to%20Sorted%20Doubly%20Linked%20List.cpp					
Coding Interviews	Binary Tree	Diameter of Binary Tree	https://leetcode.com/problems/diameter-of-binary-tree/	Given the root of a binary tree, return the length of the diameter of the tree.  The diameter of a binary tree is the length of the longest path between any two nodes in a tree. This path may or may not pass through the root.  The length of a path between two nodes is represented by the number of edges between them.	O(n)	O(h)	We're expecting an optimized solution of time complexity O(n) and memory complexity O(h).	In-order Traversal Of All Nodes	Recursive Approach	Two Pair	Traversal + Hash Set	B	Inefficient! METHOD: traverse all nodes and find the longest path between any two nodes. WEAKNESS: this approach is suboptimal because it has a time complexity of O(n^2) - wildly inefficient, especially for larger trees.	Correct!  METHOD: recursive calculation of the height of the binary tree, with the base case being when the root is null (returning 0). The height of a node is the maximum of the height of its left and right subtrees plus one (for the root itself). During the height calculation, the maximum diameter is updated by taking the sum of left and right heights of the current node, then checking if it's greater than the current maximum diameter. Time Complexity: O(n) because each node is visited once Memory Complexity: O(h), where h is the height of the tree, due to the recursive calls.	No! Two Pair is frequently a winning hand in poker, but isn't used in computer science yet.	Suboptimal. This would require storing the maximum diameter of each node, which would be more efficiently done during the height calculation itself. The main weakness?  This requires much more memory than the optimal approach.	Brute-force approach: calculate the longest path between any two nodes in the tree using a recursive function that computes the height of the left and right subtrees for each node, returning the maximum diameter found so far. 1) Initialize a variable max_diameter to 0. 2) Define a recursive function (height) that takes a node as input and returns its height - updating max_diameter if the diameter that includes the node is greater than max_diameter. 3) In the height function, compute the height of the left and right subtrees recursively by calling height on each child of the node. 4) Update max_diameter with the maximum of its current value and the sum of the heights of the left and right subtrees plus one (which represents the length of the path that goes through the current node). 5) Return the height of the node (which is the maximum of the heights of its left and right subtrees plus one). 6) Call the height function on the root node. 7) Return max_diameter. Time Complexity: O(n^2), where n is the number of nodes in the tree, and we compute the heights of each node's left and right subtrees. Space Complexity: O(h), where h is the height of the tree.	https://github.com/rabogan/MasteringLeetCodeInterviewApproaches/blob/main/SolutionCode/CodingInterviewsPackSolutionsCPP/543.%20Diameter%20of%20Binary%20Tree.cpp					
Coding Interviews	Binary Tree	Subtree of Another Tree	https://leetcode.com/problems/subtree-of-another-tree/	Given the roots of two binary trees root and subRoot, return true if there is a subtree of root with the same structure and node values of subRoot and false otherwise.  A subtree of a binary tree tree is a tree that consists of a node in tree and all of this node's descendants. The tree tree could also be considered as a subtree of itself.	O(m*n)	O(m+n)	We're expecting an optimized solution of time complexity O(m*n) and memory complexity O(m+n).	Tree Serialization + Pattern Matching	Convert into pre-order traversal strings + Compare	Pre-Order Traversal + Comparison	Depth-First Search	A	Correct! Alternative approaches may include traversing both trees in a recursive manner to compare node values and subtrees, which can have a better time complexity depending on the specific implementation. The time complexity of this approach is O(m*n), where m and n are the number of nodes in root and subRoot, respectively, since we need to serialize both trees and then search for the subRoot string in the root string. The space complexity is O(m+n), since we need to store the serialized strings of both trees.	This approach is suboptimal because it does not consider the tree structure and only relies on the node values.	Suboptimal because it may miss cases where the subRoot is a subtree of root but not a contiguous part of the tree. This approach traverses both trees simultaneously in pre-order and compare each node of subRoot to the corresponding node of root.	This approach is suboptimal because it checks each possible subtree, even if it is clear that the current node cannot be the root of the subRoot tree.  Use DFS to traverse the tree and check if each subtree rooted at the current node is equal to subRoot.	A brute force approach for this problem could be to traverse the entire root tree, and for each node encountered, check if its subtree is identical to the subRoot tree. To check if two subtrees are identical, we can traverse them recursively, comparing each corresponding node's value and children. Here is a more detailed algorithm: 1) Define a recursive function isIdentical(node1, node2) that returns true if the two trees rooted at node1 and node2 are identical, and false otherwise. 2) The base case for the recursion is when either node1 or node2 is null. In this case, return true if both node1 and node2 are null, and false otherwise. 3) If the values of node1 and node2 are different, return false. 4) Recursively call isIdentical on the left and right subtrees of node1 and node2, and return true if both calls return true. 5) Traverse the root tree recursively. For each node encountered, call isIdentical with its subtree and the subRoot tree. If the call returns true, return true. 6) If no subtree of root is identical to the subRoot tree, return false. The time complexity: O(n * m), where n is the number of nodes in root and m is the number of nodes in subRoot. In the worst case, we will have to compare every node in the root tree to the subRoot tree.  In space, it's O(max(n, m)), the space used by the recursive call stack.	https://github.com/rabogan/MasteringLeetCodeInterviewApproaches/blob/main/SolutionCode/CodingInterviewsPackSolutionsCPP/572.%20Subtree%20of%20Another%20Tree.cpp					
Coding Interviews	Binary Tree	Flip Equivalent Binary Trees	https://leetcode.com/problems/flip-equivalent-binary-trees/	For a binary tree T, we can define a flip operation as follows: choose any node, and swap the left and right child subtrees.  A binary tree X is flip equivalent to a binary tree Y if and only if we can make X equal to Y after some number of flip operations.  Given the roots of two binary trees root1 and root2, return true if the two trees are flip equivalent or false otherwise.	O(n)	O(n)	We're expecting an optimized solution of time complexity O(n) and memory complexity O(n).	Inorder and Postorder Traversal + Comparison	HSO Algorithm	Canonical Parenthesis Representation	Parallel Traversal + Comparison	C	This approach is incorrect because two trees can have different shapes but still be flip equivalent!	D'oh! This stands for 'Homer Simpson Optimization' Algorithm, which looks for the laziest and most inefficient solution to the problem.  Perfect for those who look at a problem and think 'Can't someone else do it?'	Correct! The method constructs a string representation of the binary tree for each input tree by performing a canonical parenthetical traversal. This traversal ensures that subtrees with the same structure are represented in the same way. The method then compares the two string representations for equality to determine if the two trees are flip equivalent. Time Complexity: O(N), where N is the number of nodes in the larger tree, as each node is visited once during the traversal. Memory Complexity: O(N) for storing the string representation of the tree.	This approach is inferior because it is more complex than the solution provided, which simply compares the canonical representations of the trees. Additionally, this approach may not terminate if the trees are not flip equivalent.	A simple brute force approach to solve this problem would be to check if the roots of the two given trees are either equal or symmetric. If they are, then we recursively check if their left and right subtrees are flip equivalent. If both subtrees are flip equivalent, then we return true, otherwise we return false. This approach has a time complexity of O(n^2) in the worst case, where n is the number of nodes in the tree. This is because we may need to check each node of one tree against each node of the other tree.	https://github.com/rabogan/MasteringLeetCodeInterviewApproaches/blob/main/SolutionCode/CodingInterviewsPackSolutionsCPP/951.%20Flip%20Equivalent%20Binary%20Trees.cpp					
Coding Interviews	Binary Tree	Lowest Common Ancestor of a Binary Tree	https://leetcode.com/problems/lowest-common-ancestor-of-a-binary-tree/	Given a binary tree, find the lowest common ancestor (LCA) of two given nodes in the tree.  According to the definition of LCA on Wikipedia: ‘The lowest common ancestor is defined between two nodes p and q as the lowest node in T that has both p and q as descendants (where we allow a node to be a descendant of itself).’	O(n)	O(h)	We're expecting an optimized solution of time complexity O(n) and memory complexity O(h).	Traversal + Two Arrays	Recursive Approach	Node-by-node calculation	Convert into a BST	B	Inferior. This approach has a time complexity of O(n^2) in the worst case (when the two nodes are the farthest apart in the tree) and requires O(n) extra space to store the two arrays.	Correct! It checks if the root is NULL or if the root is either p or q, and if so, it returns the root. Then it recursively checks for the lowest common ancestor in the left and right subtrees of the root. The final result is the root itself if both left and right subtrees have non-null values, left subtree if left is non-null, and right subtree if right is non-null. Time Complexity: O(n), where n is the number of nodes in the binary tree.	Rather inefficient. For each node in the tree, calculate the distance from the node to both p and q, and keep track of the node with the smallest sum of distances This approach has a time complexity of O(n^2) in the worst case (when the two nodes are the farthest apart in the tree), as for each node in the tree we need to traverse to p and q, and a space complexity of O(1) as we are not storing any additional data structures.	Incorrect! This can modify the structure of the original binary tree, which would result in an incorrect lowest common ancestor. Additionally, it's not always possible to convert a binary tree to a binary search tree without changing the structure of the tree.	A simple brute force approach to finding the lowest common ancestor of two nodes in a binary tree is to perform a post-order traversal of the tree. For each node encountered during the traversal, check if the node is either p or q. If the node is either p or q, return the node. If the node is not p or q, check if both p and q are descendants of the node. If so, return the node. If not, continue traversing the tree until a node is found that satisfies one of the previous conditions. If no such node is found, return null. The time complexity of this approach is O(n^2) in the worst case, where n is the number of nodes in the tree. This is because in the worst case, the algorithm may traverse the entire tree for each node encountered during the traversal. The space complexity of this approach is O(h), where h is the height of the tree, due to the use of a call stack during the traversal.	https://github.com/rabogan/MasteringLeetCodeInterviewApproaches/blob/main/SolutionCode/CodingInterviewsPackSolutionsCPP/236.%20Lowest%20Common%20Ancestor%20of%20a%20Binary%20Tree.cpp					
Coding Interviews	Binary Tree	Lowest Common Ancestor of a Binary Tree III	https://leetcode.com/problems/lowest-common-ancestor-of-a-binary-tree-iii/	Given two nodes of a binary tree p and q, return their lowest common ancestor (LCA).  Each node will have a reference to its parent node. The definition for Node is below:  class Node { public int val; public Node left; public Node right; public Node parent; } According to the definition of LCA on Wikipedia: ‘The lowest common ancestor of two nodes p and q in a tree T is the lowest node that has both p and q as descendants (where we allow a node to be a descendant of itself).’	O(h)	O(1)	We're expecting an optimized solution of time complexity O(h) and memory complexity O(1).	Traversal + Set	Level-order Traversal	Recursive Traversal	Simple Traversal Of the Parent Pointers	D	Too much space required! This approach requires additional memory to store the visited nodes, and may have a worst-case time complexity of O(n) when the binary tree is degenerate, resulting in a long parent chain for one of the nodes. Starting from one of the nodes, traverse up the parent node chain until reaching the root node, and store all visited nodes in a set. Then, starting from the other node, traverse up the parent node chain, checking if any of the visited nodes have already been encountered. Return the first encountered node.	Not ideal. Perform a level-order traversal on the binary tree, and check each level to see if both nodes are present. When the nodes are not present on the same level, return the previously seen level's common ancestor. This approach is inefficient, as it requires checking all nodes in the binary tree, and it may also require additional storage to keep track of the previously seen level's common ancestor.	Quite inefficient. Starting from the root node, recursively traverse the binary tree while maintaining a path for both nodes. Return the deepest common node in the path. This approach has a time complexity of O(n^2) in the worst case scenario where the binary tree is unbalanced, and the two nodes are on opposite sides of the tree.	Correct! Starting from the given nodes, we traverse their respective parent pointers until we reach a common node, which is the lowest common ancestor (LCA) of the two nodes. Time Complexity: O(h) where h is the height of the tree. Space complexity: O(1).	A simple brute force approach for finding the lowest common ancestor of two nodes in a binary tree with parent pointers is as follows: Start from node p and traverse up to its root by following its parent pointers, and store all the nodes visited in a hash set. Start from node q and traverse up to its root by following its parent pointers. At each step, check if the current node is present in the hash set of nodes visited in step 1. If it is, then this is the lowest common ancestor. If the root is reached in step 2 without finding the lowest common ancestor, repeat the same process by starting from node q and traversing up to its root, and storing the visited nodes in a hash set. Then, start from node p and traverse up to its root, checking at each step if the current node is present in the hash set of nodes visited in step 2. This approach has a time complexity of O(h) where h is the height of the tree, since in the worst case we may need to traverse up to the root twice. The space complexity is also O(h) since we store the visited nodes in hash sets.	https://github.com/rabogan/MasteringLeetCodeInterviewApproaches/blob/main/SolutionCode/CodingInterviewsPackSolutionsCPP/1650.%20Lowest%20Common%20Ancestor%20of%20a%20Binary%20Tree%20III.cpp					
Coding Interviews	Binary Tree	Intersection of Two Linked Lists	https://leetcode.com/problems/intersection-of-two-linked-lists/	Given the heads of two singly linked-lists headA and headB, return the node at which the two lists intersect. If the two linked lists have no intersection at all, return null.  The test cases are generated such that there are no cycles anywhere in the entire linked structure. Note that the linked lists must retain their original structure after the function returns. The inputs to the judge are given as follows (your program is not given these inputs):  intersectVal - The value of the node where the intersection occurs. This is 0 if there is no intersected node. listA - The first linked list. listB - The second linked list. skipA - The number of nodes to skip ahead in listA (starting from the head) to get to the intersected node. skipB - The number of nodes to skip ahead in listB (starting from the head) to get to the intersected node. The judge will then create the linked structure based on these inputs and pass the two heads, headA and headB to your program. If you correctly return the intersected node, then your solution will be accepted.	O(n+m)	O(1)	We're expecting an optimized solution of time complexity O(n+m) and memory complexity O(1) (**NOTE** There are multiple alternatives too!).	Traversal + Arrays	Traversal+ Direct Comparison	Traversal + Hash Set	Two Pointers	D	No!  The solution can be achieved in O(1) space. In this approach, we create two pointers, one for each linked list, and iterate over them until they meet. To ensure that both pointers have traveled the same distance when they collide, we reset a pointer to the head of the opposite list when it reaches the end of its own list. This allows us to find the intersection point of the two linked lists in O(m + n) time, where m and n are the lengths of the linked lists. This approach requires O(n) space complexity and is suboptimal compared to the O(1) space complexity required by the correct solution.	This approach has a time complexity of O(n^2), which is inefficient for large linked lists.	Unfortunately, no. This approach requires O(n) space complexity and is suboptimal compared to the O(1) space complexity required by the correct solution. Additionally, it also requires two passes through the linked lists, whereas the correct solution only requires one pass. The idea is that we traverse linked list A and store all the node addresses in a hash set. Then, traverse linked list B and for each node, check if it exists in the hash set.	Correct! In this approach, we create two pointers, one for each linked list, and iterate over them until they meet. To ensure that both pointers have traveled the same distance when they collide, we reset a pointer to the head of the opposite list when it reaches the end of its own list. This allows us to find the intersection point of the two linked lists in O(m + n) time, where m and n are the lengths of the linked lists.	One simple brute force approach to solving this problem is to traverse through both linked lists and compare each node of the first list with every node of the second list until a matching node is found. However, this approach would have a time complexity of O(mn) where m and n are the lengths of the two linked lists, which is not efficient. A more optimized approach would be to first find the lengths of both linked lists, and then traverse the longer linked list by the difference in lengths between the two lists to reach the starting point of the intersection. Then, both linked lists can be traversed together until a matching node is found. This approach has a time complexity of O(m+n), which is more efficient.	https://github.com/rabogan/MasteringLeetCodeInterviewApproaches/blob/main/SolutionCode/CodingInterviewsPackSolutionsCPP/160.%20Intersection%20of%20Two%20Linked%20Lists.cpp					
